{
  "contract_version": "1.0.0",
  "kind": "SCENARIO",
  "scenario_id": "runtime-equilibrium-single",
  "random_seed": 20260918,
  "requested_fidelity_tier": "HIGH_FIDELITY",
  "requested_solver": {
    "backend": "equilibrium",
    "features": {}
  },
  "environment": {
    "gravity_m_s2": [
      0,
      0,
      0
    ],
    "ambient_density_kg_m3": 1.2041,
    "ambient_dynamic_viscosity_pa_s": 0.00001825
  },
  "initial_bubbles": [
    {
      "id": "bubble-1",
      "volume_m3": 0.000004188790204786391,
      "equivalent_radius_m": 0.01,
      "centroid_m": [
        0,
        0,
        0
      ],
      "velocity_m_s": [
        0,
        0,
        0
      ],
      "status": "ALIVE",
      "film_material": {
        "effective_sheet_tension_n_m": 0.05
      }
    }
  ],
  "user_editable": {
    "features": {}
  },
  "metadata": {
    "purpose": "generated runtime integration scenario"
  }
}
