{
  "contract_version": "1.0.0",
  "kind": "SCENARIO",
  "scenario_id": "contact-thinfilm-event-drainage",
  "random_seed": 20260919,
  "requested_fidelity_tier": "HIGH_FIDELITY",
  "requested_solver": {
    "backend": "contact-thinfilm-event",
    "features": {
      "film_sheet_geometry": true,
      "bulk_incompressible_flow": true,
      "automatic_contact_detection": true,
      "transient_contact_detection": true,
      "shared_films": true,
      "shared_film_topology": true,
      "dynamic_shared_films": true,
      "drainage": true,
      "surfactant_diffusion": true,
      "variable_surface_tension": true,
      "gas_diffusion": true,
      "coarsening": true,
      "topology_change": true,
      "rupture": false,
      "coalescence": false
    }
  },
  "environment": {
    "gravity_m_s2": [0.0, -9.81, 0.0],
    "ambient_density_kg_m3": 1.204,
    "ambient_dynamic_viscosity_pa_s": 0.00001825,
    "ambient_pressure_pa": 101325.0,
    "wind": {
      "velocity_m_s": [0.0, 0.0, 0.0],
      "description": "Zero mean flow; contact approach uses the accepted deterministic divergence-free contact strain."
    }
  },
  "initial_bubbles": [
    {
      "id": "bubble-a",
      "volume_m3": 0.000004188790204786391,
      "equivalent_radius_m": 0.01,
      "centroid_m": [0.0, 0.0, -0.01069],
      "velocity_m_s": [0.0, 0.0, 0.0],
      "status": "ALIVE",
      "pressure_pa": null,
      "temperature_k": 298.15,
      "gas_amount_mol": 0.00018,
      "gas_species": "air",
      "film_material": {"effective_sheet_tension_n_m": 0.05}
    },
    {
      "id": "bubble-b",
      "volume_m3": 0.000004188790204786391,
      "equivalent_radius_m": 0.01,
      "centroid_m": [0.0, 0.0, 0.01069],
      "velocity_m_s": [0.0, 0.0, 0.0],
      "status": "ALIVE",
      "pressure_pa": null,
      "temperature_k": 298.15,
      "gas_amount_mol": 0.00016,
      "gas_species": "air",
      "film_material": {"effective_sheet_tension_n_m": 0.05}
    }
  ],
  "user_editable": {
    "features": {},
    "contact_runtime": {
      "subdivisions": 2,
      "max_dt_s": 0.0005,
      "grid": {
        "cells": [10, 10, 10],
        "origin_m": [-0.03, -0.03, -0.03],
        "extent_m": [0.06, 0.06, 0.06],
        "pressure_iterations": 160
      },
      "initial_flow": {
        "model": "periodic_divergence_free_contact_strain_z",
        "amplitude_m_s": 0.2
      },
      "contact": {
        "threshold_edge_fraction": 0.45,
        "max_interpenetration_edge_fraction": 0.35
      },
      "network": {
        "dt_s": 0.0002,
        "mobility_m_per_n_s": 0.02,
        "max_displacement_edge_fraction": 0.025
      }
    },
    "runtime": {"output_cadence_s": 0.02},
    "thinfilm": {
      "initial_thickness_m": 0.00002,
      "initial_surfactant_mol_m2": 0.000001,
      "enable_drainage": true,
      "enable_surfactant_diffusion": true,
      "enable_gas_diffusion": true,
      "dynamic_viscosity_pa_s": 0.001,
      "liquid_density_kg_m3": 1000.0,
      "surfactant_diffusivity_m2_s": 1e-9,
      "clean_surface_tension_n_m": 0.052,
      "surface_elasticity_n_m_per_mol_m2": 2000.0,
      "minimum_surface_tension_n_m": 0.02,
      "disjoining_coefficient_pa_m3": 0.0,
      "positivity_safety": 0.45,
      "max_substeps": 10000,
      "gas_permeability_mol_m_per_m2_s_pa": 1e-11
    },
    "events": {
      "enable_rupture": false,
      "coalesce_on_shared_film_rupture": true,
      "thickness_threshold_m": 1e-8,
      "dwell_time_s": 0.0,
      "allow_user_trigger": false,
      "deterministic_seed": 271828
    }
  },
  "metadata": {
    "purpose": "contact-created shared film handed without geometric replacement into accepted drainage, surfactant and gas-transfer physics"
  }
}
